{
  "$schema": "https://json-schema.org/draft/2020-12/schema",
  "$id": "https://wattsteer.com/schema/replay.schema.json",
  "title": "Replay",
  "description": "`GET /v1/replay?d=&s=&subsystem=` and `POST /v1/replay` - `docs/specs/replay.md`'s contract, re-pathed and never re-shaped. The top-level scalars share their names with `OptimizationResult` and mean something different: they are evaluated on the **observed** realisation, which is why `scored_on` exists on the object. Without that field the two results are a trap. `forecast.day_total` comes from the path ensemble and is never a componentwise sum of the hourly band.",
  "type": "object",
  "properties": {
    "target_date": { "$ref": "common.schema.json#/$defs/civil_date" },
    "subsystem": { "$ref": "common.schema.json#/$defs/subsystem" },
    "threshold_mw": { "$ref": "common.schema.json#/$defs/threshold_mw" },
    "max_gap_hours": { "$ref": "common.schema.json#/$defs/max_gap_hours" },
    "scenario_hash": { "$ref": "common.schema.json#/$defs/scenario_hash" },
    "integrity": { "$ref": "#/$defs/integrity" },
    "vintage_fidelity": {
      "$ref": "common.schema.json#/$defs/vintage_fidelity",
      "description": "Top level, exactly as in `OptimizationResult`: a field whose whole purpose is that shared names do not shift meaning must not shift position either. The vintage *detail* under `integrity` is replay-only; the verdict is not."
    },
    "forecast_origin": { "$ref": "common.schema.json#/$defs/forecast_origin" },
    "actual": { "$ref": "#/$defs/actual" },
    "forecast": { "$ref": "#/$defs/forecast" },
    "planning_basis": { "type": "string", "enum": ["p10", "p50", "p90"] },
    "execution_rule": { "type": "string", "enum": ["follow_curtailment"] },
    "scored_on": {
      "type": "string",
      "enum": ["observed", "p10", "p50", "p90"],
      "description": "Which realisation the top-level scalars were evaluated on. A Replay scores against what happened, which is the entire point."
    },
    "baseline_curtailment_mwh": { "type": "number", "minimum": 0 },
    "optimized_curtailment_mwh": { "type": "number", "minimum": 0 },
    "avoided_energy_mwh": { "type": "number", "minimum": 0 },
    "avoidability": { "$ref": "common.schema.json#/$defs/avoidability" },
    "recovered_floor_mwh": { "type": "number", "minimum": 0 },
    "floor_met": { "type": "boolean" },
    "floor_margin_mwh": { "type": "number" },
    "scored": {
      "type": "object",
      "properties": {
        "p10": { "$ref": "common.schema.json#/$defs/scored_realisation" },
        "p50": { "$ref": "common.schema.json#/$defs/scored_realisation" },
        "p90": { "$ref": "common.schema.json#/$defs/scored_realisation" },
        "observed": { "$ref": "common.schema.json#/$defs/scored_realisation" }
      },
      "required": ["p10", "p50", "p90", "observed"],
      "additionalProperties": false
    },
    "upper_bound": {
      "description": "What perfect foresight would have recovered, and the gap the forecast cost.",
      "type": "object",
      "properties": {
        "label": { "type": "string", "enum": ["perfect_foresight"] },
        "recovered_mwh": { "type": "number", "minimum": 0 },
        "avoidability": { "$ref": "common.schema.json#/$defs/avoidability" },
        "forecast_value_gap_mwh": { "type": "number" }
      },
      "required": ["label", "recovered_mwh", "avoidability", "forecast_value_gap_mwh"],
      "additionalProperties": false
    },
    "dispatch": {
      "description": "Scheduled, on the planning envelope - the plan.",
      "type": "array",
      "items": { "$ref": "common.schema.json#/$defs/dispatch_hour" }
    },
    "executed": {
      "description": "What the execution rule did against the observed - the reality.",
      "type": "array",
      "items": { "$ref": "common.schema.json#/$defs/dispatch_hour" }
    },
    "stored_at_horizon_end_mwh": { "type": "number", "minimum": 0 },
    "round_trip_loss_mwh": { "type": "number", "minimum": 0 },
    "economic_scenario": { "$ref": "common.schema.json#/$defs/economic_scenario" },
    "episodes": {
      "type": "array",
      "items": { "$ref": "common.schema.json#/$defs/episode" }
    },
    "solver": { "$ref": "common.schema.json#/$defs/solver" }
  },
  "required": [
    "target_date",
    "subsystem",
    "threshold_mw",
    "max_gap_hours",
    "scenario_hash",
    "integrity",
    "vintage_fidelity",
    "forecast_origin",
    "actual",
    "forecast",
    "planning_basis",
    "execution_rule",
    "scored_on",
    "baseline_curtailment_mwh",
    "optimized_curtailment_mwh",
    "avoided_energy_mwh",
    "avoidability",
    "recovered_floor_mwh",
    "floor_met",
    "floor_margin_mwh",
    "scored",
    "upper_bound",
    "dispatch",
    "executed",
    "stored_at_horizon_end_mwh",
    "round_trip_loss_mwh",
    "economic_scenario",
    "episodes",
    "solver"
  ],
  "additionalProperties": false,
  "$defs": {
    "integrity": {
      "title": "ReplayIntegrity",
      "description": "Asserted at read time, never computed hopefully. `provenance` and `vintage_fidelity` are two axes and neither is derived from the other: the first is the model's information set, the second is the data's. `revision_premium_recovered_mwh` is `null` when unmeasured, and says so, rather than standing in as a zero.",
      "type": "object",
      "properties": {
        "provenance": { "type": "string", "enum": ["served", "fold_holdout"] },
        "model_saw_this_day": { "type": "boolean" },
        "held_out_by": {
          "oneOf": [
            { "type": "null" },
            {
              "type": "object",
              "properties": {
                "fold": { "type": "string" },
                "artifact_id": { "type": "string" },
                "train_window": { "$ref": "#/$defs/date_window" },
                "calibration_window": { "$ref": "#/$defs/date_window" }
              },
              "required": ["fold", "artifact_id", "train_window", "calibration_window"],
              "additionalProperties": false
            }
          ]
        },
        "vintage_fidelity": {
          "$ref": "common.schema.json#/$defs/vintage_fidelity",
          "description": "The same verdict the top-level field carries, beside `provenance` so the two honesty axes are read against each other. One value, one source: the day's position relative to the go-live of the reads its actuals depend on. Today every `fold_holdout` day is also `revision_optimistic`, which is exactly why a merged badge is refused."
        },
        "vintage_affects": { "type": "array", "items": { "type": "string" } },
        "vintage_exempt": { "type": "array", "items": { "type": "string" } },
        "revision_premium_recovered_mwh": { "type": ["number", "null"] }
      },
      "required": [
        "provenance",
        "model_saw_this_day",
        "held_out_by",
        "vintage_fidelity",
        "vintage_affects",
        "vintage_exempt",
        "revision_premium_recovered_mwh"
      ],
      "additionalProperties": false
    },
    "date_window": {
      "title": "ReplayDateWindow",
      "type": "array",
      "prefixItems": [
        { "$ref": "common.schema.json#/$defs/civil_date" },
        { "$ref": "common.schema.json#/$defs/civil_date" }
      ],
      "items": false,
      "minItems": 2,
      "maxItems": 2
    },
    "actual": {
      "title": "ReplayActual",
      "type": "object",
      "properties": {
        "total_mwh": { "type": "number", "minimum": 0 },
        "peak_mw": { "type": "number", "minimum": 0 },
        "hours": {
          "type": "array",
          "minItems": 24,
          "maxItems": 24,
          "items": { "type": "number", "minimum": 0 }
        }
      },
      "required": ["total_mwh", "peak_mw", "hours"],
      "additionalProperties": false
    },
    "forecast": {
      "title": "ReplayForecast",
      "type": "object",
      "properties": {
        "hours": {
          "type": "array",
          "minItems": 24,
          "maxItems": 24,
          "items": { "$ref": "#/$defs/forecast_hour" }
        },
        "day_total": {
          "$ref": "common.schema.json#/$defs/band",
          "description": "Path ensemble. **Not** a sum of the 24 hourly quantiles."
        },
        "peak_power": { "$ref": "common.schema.json#/$defs/band" },
        "day_occurrence_probability": { "$ref": "common.schema.json#/$defs/probability" }
      },
      "required": ["hours", "day_total", "peak_power", "day_occurrence_probability"],
      "additionalProperties": false
    },
    "forecast_hour": {
      "title": "ReplayForecastHour",
      "description": "`docs/specs/replay.md` writes this hour as `{ p10, p50, p90, expected_mwh, occurrence_probability }` inside an elision comment rather than as a literal example. Spelled out here as a `Band` plus siblings, because flattening the three quantiles alongside `expected_mwh` would put an expectation inside a band-shaped object (vocabulary rule 2) and would hide a band from a grep for the shared reference (rule 1). Same five numbers, and the same hour shape the forecast route already returns.",
      "type": "object",
      "properties": {
        "constrained_off_mwh": { "$ref": "common.schema.json#/$defs/band" },
        "expected_mwh": {
          "type": "number",
          "minimum": 0,
          "description": "A sibling of the band, never its centre."
        },
        "occurrence_probability": { "$ref": "common.schema.json#/$defs/probability" }
      },
      "required": ["constrained_off_mwh", "expected_mwh", "occurrence_probability"],
      "additionalProperties": false
    }
  }
}
